department_tag,course_code,name,credits,description,corequisites,prerequisites,attributes,department,group_numbers
CS,5360,Noninteractive Computer Graphics,4,"Introduces computer graphics algorithms and concepts. Focuses on offline rendering techniques. Consists of a lecture component and in-class laboratory offering instruction about common image synthesis algorithms and techniques to generate images used in games and 3D-animated movies. Culminates in a final individual or group project to complete a renderer for generating high-quality images. This course is appropriate for students interested in a career as a graphics, rendering, or high-performance computer engineer.",[],[],[],Computer Science,[]
CS,5400,Principles of Programming Language,4,"Studies the basic components of programming languages, specification of syntax and semantics, and description and implementation of programming language features. Discusses examples from a variety of languages.",[],"['CS 5010', 'CS 5004', 'CS 5010']",[],Computer Science,"[1, 1, 1]"
CS,5500,Foundations of Software Engineering,4,"Covers the foundations of software engineering, including software development life cycle models (e.g., waterfall, spiral, agile); requirements analysis; user-centered design; software design principles and patterns; testing (functional testing, structural testing, testing strategies); code refactoring and debugging; software architecture and design; and integration and deployment. Includes a course project where some of the software engineering methods (from requirements analysis to testing) are applied in a team-based setting. Requires admission to MS program or completion of all transition courses.",[],"['CS 5010', 'CS 5004', 'CS 5010']",['Writing Intensive'],Computer Science,"[1, 1, 1]"
CS,5520,Mobile Application Development,4,"Focuses on mobile application development on a mobile phone or related platform. Discusses memory management; user interface building, including both MVC principles and specific tools; touch events; data handling, including core data, SQL, XML, and JSON; network techniques and URL loading; and, finally, specifics such as GPS and motion sensing that may be dependent on the particular mobile platform. Students are expected to work on a project that produces a professional-quality mobile application and to demonstrate the application that they have developed. The instructor chooses a modern mobile platform to be used in the course.",[],[],[],Computer Science,[]
CS,5540,Game Programming,4,Covers the skills needed to develop easily scalable and modifiable scripts that can be used to implement various game mechanics common to most game genres. Programming is an integral part of the digital game design and development life cycle. Designed as a foundational game programming course covering numerous aspects of game programming. At least one semester of programming experience in a high-level language is required.,[],[],[],Computer Science,[]
CS,5600,Computer Systems,4,"Studies the structure, components, design, implementation, and internal operation of computer systems, focusing mainly on the operating system level. Reviews computer hardware and architecture including the arithmetic and logic unit, and the control unit. Covers current operating system components and construction techniques including the memory and memory controller, I/O device management, device drivers, memory management, file system structures, and the user interface. Introduces distributed operating systems. Discusses issues arising from concurrency and distribution, such as scheduling of concurrent processes, interprocess communication and synchronization, resource sharing and allocation, and deadlock management and resolution. Includes examples from real operating systems. Exposes students to the system concepts through programming exercises. Requires admission to MS program or completion of all transition courses.",[],[],[],Computer Science,[]
CS,5610,Web Development,4,"Discusses Web development for sites that are dynamic, data driven, and interactive. Focuses on the software development issues of integrating multiple languages, assorted data technologies, and Web interaction. Considers ASP.NET, C#, HTTP, HTML, CSS, XML, XSLT, JavaScript, AJAX, RSS/Atom, SQL, and Web services. Each student must deploy individually designed Web experiments that illustrate the Web technologies and at least one major integrative Web site project. Students may work in teams with the permission of the instructor. Each student or team must also create extensive documentation of their goals, plans, design decisions, accomplishments, and user guidelines. All source files must be open and be automatically served by a sources server.",[],[],"['Capstone Experience', 'Writing Intensive']",Computer Science,[]
CS,5700,Fundamentals of Computer Networking,4,"Studies network protocols, focusing on modeling and analysis, and architectures. Introduces modeling concepts, emphasizing queuing theory, including Little’s theorem, M/M/1, M/M/m, M/D/1, and M/G/1 queuing systems. Discusses performance evaluation of computer networks including performance metrics, evaluation tools and methodology, simulation techniques, and limitations. Presents the different harmonizing functions needed for communication and efficient operation of computer networks and discusses examples of Ethernet, FDDI, and wireless networks. Covers link layer protocols including HDLC, PPP, and SLIP; packet framing; spanning tree and learning bridges, error detection techniques, and automatic repeat request algorithms; sliding window and reliable/ordered services; and queuing disciplines including FQ and WFQ. Introduces flow control schemes, such as window flow control and leaky bucket rate control schemes, and discusses congestion control and fairness. Requires knowledge of probability theory.",[],[],[],Computer Science,[]
CS,5800,Algorithms,4,"Presents the mathematical techniques used for the design and analysis of computer algorithms. Focuses on algorithmic design paradigms and techniques for analyzing the correctness, time, and space complexity of algorithms. Topics may include asymptotic notation, recurrences, loop invariants, Hoare triples, sorting and searching, advanced data structures, lower bounds, hashing, greedy algorithms, dynamic programming, graph algorithms, and NP-completeness.",[],[],['Formal/Quant Reasoning'],Computer Science,[]
CS,5850,Building Game Engines,4,"Discusses the components of game engines and strategies for their software implementation. Includes graphics management algorithms (animation, scene graph, level of detail); basic artificial intelligence algorithms (search, decision making, sensing); and related algorithmic issues (networking, threading, input processing). Explores the use of data-driven software design. Offers students an opportunity to use a rendering engine and to build and integrate several software components to create a complete game engine. Requires students to work on individual assignments and then develop a project in a team, which requires a report. Offers students an opportunity to learn team/project management; work division; team communication; and the software development cycle of implementation, testing, critique, and further iteration. Requires knowledge of computer graphics, differential calculus, operating systems concepts, and algorithms.",[],[],[],Computer Science,[]
CS,5933,Advanced Computer Science Topics for Teachers,4,"Offers learners intending to be certified as K–12 computer science educators an advanced programming course. Covers GUI development and event-driven programming, an introduction to modeling and simulation, basics of computer networking and security, as well as topics related to the state of the art in computer science.",[],[],[],Computer Science,[]
CS,5934,Introduction to Inclusive Computer Science Teaching,4,"Introduces teaching computer science (CS) in grades K–12. Focuses on integrating CS concepts with other topic areas. Includes working with multilingual learners—examining student identities with respect to CS and exploring strategies for creating an inclusive CS classroom. Offers students an opportunity to design and practice implementing lesson plans for CS curricula at all grade levels, to explore current research in CS education, and to build a portfolio of teaching resources.",[],[],[],Computer Science,[]
CS,5964,Projects for Professionals,0,"Offers students an applied project setting in which to apply their curricular learning. Working with a sponsor, students refine an applied research topic, perform research, develop recommendations that are shared with a partner sponsor, and create a plan for implementing their recommendations. Seeks to benefit students with a curriculum that supports the development of key business communication skills, project and client management skills, and frameworks for business analysis. Offers students an opportunity to learn from sponsor feedback, review 'lessons learned,' and incorporate suggestions from this review to improve and further develop their career development and professional plan. May be repeated twice.",[],[],[],Computer Science,[]
CS,5965,Engaging with Industry Partners for Rising Professionals,0,"Offers students an enhanced applied project setting in which to apply their curricular learning. Working with a partner sponsor, students refine an applied research topic, perform research, develop recommendations that are shared with the partner sponsor, and create a plan for implementing their recommendations. Curriculum supports students as they develop key business communication skills, project and client management skills, and frameworks for business analysis. Offers students an opportunity to learn from sponsor feedback, review lessons learned, and incorporate suggestions to improve and further hone their career development and professional plan. Career development opportunities through skill-building workshops, panels, and interview preparation are available. Partner-student interactions, including a culminating project presentation, allow partners to assess student potential for co-op, internship, or other employment opportunities with the partner. May be repeated two times.",[],[],[],Computer Science,[]
CS,6120,Natural Language Processing,4,"Provides an introduction to the computational modeling of human language, the ongoing effort to create computer programs that can communicate with people in natural language, and current applications of the natural language field, such as automated document classification, intelligent query processing, and information extraction. Topics include computational models of grammar and automatic parsing, statistical language models and the analysis of large text corpuses, natural language semantics and programs that understand language, models of discourse structure, and language use by intelligent agents. Course work includes formal and mathematical analysis of language models, and implementation of working programs that analyze and interpret natural language text.",[],[],[],Computer Science,[]
CS,6130,Affective Computing,4,"Studies affective computing—computing that relates to, arises from, or influences emotions. Offers an overview of the theory of human emotion (how it arises from and influences cognition, the body, and the social environment) and computational techniques for modeling human emotion processes as well as for recognizing and synthesizing emotional behavior. Discusses how these can be applied to application design. Offers students an opportunity to gain a strong background in the theory and practice of human-centered computing as it relates to games, immersive environments, and pedagogical applications. Brings together students from different disciplines to work together and learn from each other. CS 6130 and PSYC 6130 are cross-listed.",[],[],[],Computer Science,[]
CS,6140,Machine Learning,4,"Provides a broad look at a variety of techniques used in machine learning and data mining, and also examines issues associated with their use. Topics include algorithms for supervised learning including decision tree induction, artificial neural networks, instance-based learning, probabilistic methods, and support vector machines; unsupervised learning; and reinforcement learning. Also covers computational learning theory and other methods for analyzing and measuring the performance of learning algorithms. Course work includes a programming term project.",[],"['CS 5800', 'CS 7800']",[],Computer Science,"[1, 1]"
CS,6170,AI Capstone,4,Offers students a culminating experience through one or more projects to apply key concepts learned throughout their program in the core and elective courses. Emphasizes exploiting domain knowledge to facilitate interaction between humans and systems; developing intelligent interaction technologies; and critically assessing their social and ethical impacts.,[],"['CS 5100', 'CS 5130', 'CS 5800', 'CS 6140', 'EECE 5644']",[],Computer Science,"[1, 1, 1, 1, 1]"
CS,6180,Foundations for Generative AI,4,"Offers students an opportunity to obtain both the theoretical foundation and practical skills to understand, analyze, and apply generative AI techniques effectively. Begins with foundational concepts in AI and machine learning; progresses to advanced natural language processing, transformer models, and large language models; and concludes with cutting-edge techniques like prompt engineering, domain-specific adaptations, and retrieval-augmented generation.",[],"['CS 5100', 'CS 5180', 'CS 6120', 'CS 6140', 'CS 7140', 'CS 7150']",[],Computer Science,"[1, 1, 1, 1, 1, 1]"
CS,6200,Information Retrieval,4,"Provides an introduction to information retrieval systems and different approaches to information retrieval. Topics covered include evaluation of information retrieval systems; retrieval, language, and indexing models; file organization; compression; relevance feedback; clustering; distributed retrieval and metasearch; probabilistic approaches to information retrieval; Web retrieval; filtering, collaborative filtering, and recommendation systems; cross-language IR; multimedia IR; and machine learning for information retrieval.",[],[],[],Computer Science,[]
CS,6220,Data Mining Techniques,4,"Covers various aspects of data mining, including classification, prediction, ensemble methods, association rules, sequence mining, and cluster analysis. The class project involves hands-on practice of mining useful knowledge from a large data set.",[],"['CS 5800', 'CS 7800']",[],Computer Science,"[1, 1]"
CS,6240,Large-Scale Parallel Data Processing,4,"Covers big-data analysis techniques that scale out with increasing number of compute nodes, e.g., for cloud computing. Emphasizes approaches for problem and data partitioning that distribute work effectively, while keeping total cost for computation and data transfer low. Studies and analyzes deterministic and random algorithms from a variety of domains, including graphs, data mining, linear algebra, and information retrieval in terms of their cost, scalability, and robustness against skew. Course work emphasizes hands-on programming experience with modern state-of-the-art big-data processing technology. Students who do not meet course prerequisites may seek permission of instructor.",[],"['CS 5800', 'CS 7800', 'EECE 7205']",[],Computer Science,"[1, 1, 1]"
CS,6350,Empirical Research Methods,4,"Presents an overview of methods for conducting empirical research within computer science. These methods help provide objective answers to questions about the usability, effectiveness, and acceptability of systems. The course covers the basics of the scientific method, building from a survey of objective measures to the fundamentals of hypothesis testing using relatively simple research designs, and on to more advanced research designs and statistical methods. The course also includes a significant amount of fieldwork, spanning the design, conduct, and presentation of small empirical studies.",[],[],[],Computer Science,[]
CS,6410,Compilers,4,"Expects each student to write a small compiler. Topics include parser generation, abstract syntax trees, symbol tables, type checking, generation of intermediate code, simple code improvement, register allocation, run-time structures, and code generation.",[],"['CS 5400', 'CS 7400']","['Capstone Experience', 'Writing Intensive']",Computer Science,"[1, 1]"
CS,6510,Advanced Software Development,4,"Designed to integrate academic concepts and practical experience of software design by having students work as part of a programming team, with an option to lead a subteam. Offers students an opportunity to study, in-depth, some aspects of the development process. The goal is to have students participate in a large-scale project, taking time to reflect and analyze the work and the process, rather than concentrating exclusively on the final product. Students who do not meet course prerequisites may seek permission of instructor.",[],"['CS 5004', 'CS 5010', 'CS 5500']",[],Computer Science,"[1, 1, 2]"
CS,6620,Fundamentals of Cloud Computing,4,"Covers fundamentals of cloud computing, including virtualization and containers, distributed file systems and object stores, infrastructure as a service platforms, open source cloud platforms, key big data platforms, and topics in data center scale systems. Combines classroom material delivered via lectures, readings from literature, student presentations, and a semester-long software project.",[],[],[],Computer Science,[]
CS,6640,Operating Systems Implementation,4,"Introduces concepts of OS kernels. Discusses the design and implementation of today's OS kernel components, such as process abstraction, virtual memory module, and file systems. Offers students an opportunity to obtain hands-on experience in building these components step-by-step through a series of assignments on a state-of-the-art hardware platform and to implement their own OS kernels that can run on bare-metal machines.",[],"['CS 3650', 'CS 5600']",[],Computer Science,"[1, 1]"
CS,6650,Building Scalable Distributed Systems,4,"Covers the essential elements of distributed, concurrent systems and builds upon that knowledge with engineering principles and practical experience with state-of-the-art technologies and methods for building scalable systems. Scalability is an essential quality of internet-facing systems and requires specialized skills and knowledge to build systems that scale at low cost.",[],[],[],Computer Science,[]
CS,6760,"Privacy, Security, and Usability",4,"Challenges conventional wisdom and encourages students to discover ways that security, privacy, and usability can be made synergistic in system design. Usability and security are widely seen as two antagonistic design goals for complex computer systems. Topics include computer forensics, network forensics, user interface design, backups, logging, economic factors affecting adoption of security technology, trust management, and related public policy. Uses case studies such as PGP, S/MIME, and SSL. Introduces basic cryptography and hash function as it is needed. Course work includes analysis of papers, problem sets, and a substantial term project.",[],[],[],Computer Science,[]
CS,6954,Co-op Work Experience - Half-Time,0,Provides eligible students with an opportunity for work experience. May be repeated without limit.,[],[],[],Computer Science,[]
CS,6955,Co-op Work Experience Abroad - Half-Time,0,Provides eligible students with an opportunity for work experience abroad. May be repeated once.,[],[],[],Computer Science,[]
CS,6964,Co-op Work Experience,0,Provides eligible students with an opportunity for work experience. May be repeated without limit.,[],[],[],Computer Science,[]
CS,6965,Co-op Work Experience Abroad,0,Provides eligible students with an opportunity for work experience abroad. May be repeated without limit.,[],[],[],Computer Science,[]
CS,6983,Topics in Computer Science,4,Offers various topics in computer science. May be repeated once.,[],[],[],Computer Science,[]
CS,7140,Advanced Machine Learning,4,"Covers topics in advanced machine learning. Presents materials in the current machine learning literature. Focuses on graphical models, latent variable models, Bayesian inference, and nonparametric Bayesian methods. Seeks to prepare students to do research in machine learning. Expects students to read conference and journal articles, present these articles, and write an individual research paper. CS 7140 and EECE 7397 are cross-listed.",[],"['CS 6140', 'EECE 7204', 'EECE 7313']",[],Computer Science,"[1, 1, 1]"
CS,7150,Deep Learning,4,"Introduces deep learning, including the statistical learning framework, empirical risk minimization, loss function selection, fully connected layers, convolutional layers, pooling layers, batch normalization, multilayer perceptrons, convolutional neural networks, autoencoders, U-nets, residual networks, gradient descent, stochastic gradient descent, backpropagation, autograd, visualization of neural network features, robustness and adversarial examples, interpretability, continual learning, and applications in computer vision and natural language processing. Assumes students already have a basic knowledge of machine learning, optimization, linear algebra, and statistics.",[],"['CS 6140', 'DS 5220']",[],Computer Science,"[1, 1]"
CS,7180,Special Topics in Artificial Intelligence,4,Offers various topics on artificial intelligence. May be repeated up to two times.,[],[],[],Computer Science,[]
CS,7200,Statistical Methods for Computer Science,4,"Introduces concepts in applied statistics. Covers frequentist and Bayesian characterization of uncertainty for continuous and categorical data, principles of experimental design, and methods of causal inference. Discusses the methodological foundations, as well as issues of practical implementation and use.",[],[],[],Computer Science,[]
CS,7240,"Principles of Scalable Data Management: Theory, Algorithms, and Database Systems",4,"Covers the algorithms, core principles, and foundational concepts for managing data at scale. Topics include data models, query languages, query execution and optimization, complexity of query execution and query resilience, data stream processing, parallel data processing, transactions, linear vs. relational algebra, factorizations, and uncertainty in logic. Requires standard CS knowledge of algorithms and hardness (e.g., a typical undergraduate class based on a standard algorithms textbook such as Ericson; Cormen, Leiserson, Rivest,and Stein; or Dasgupta, Papadimitriou, and Vazirani). Offers students an opportunity to gain hands-on experience through smaller assignments and a project. The project is flexible to allow students to explore scalable data management and analysis aspects related to their PhD research.",[],[],[],Computer Science,[]
CS,7250,Information Visualization: Theory and Applications,4,"Covers foundational as well as contemporary topics of interest in data visualization to enable the effective representation of data across disciplines, including examples drawn from computer science, physical sciences, biomedical sciences, humanities, and economics. Topics include data visualization theory and methodology, visualization design and evaluation, visual perception and cognition, interaction principles, and data encoding and representation techniques. Students who do not meet course restrictions may seek permission of instructor.",[],[],[],Computer Science,[]
CS,7260,Visualization for Network Science,4,"Covers the principles of information visualization in the specific context of network science. Introduces visual encoding of data and our understanding of human vision and perception; interaction principles including filtering, pivoting, aggregation; and both quantitative and human subjects evaluation techniques. Covers visualization techniques for several network types, including multivariate networks with attributes for entities and relationships, evolving and dynamic networks that change over time, heterogeneous networks with multiple types of entities, and geospatial networks. Offers students an opportunity to learn about the design of layout algorithms for node-link and matrix visualizations.",[],[],[],Computer Science,[]
CS,7268,Verifiable Machine Learning,4,"Introduces verifiable machine learning, focusing on the limitations of current learning-based methods regarding safety and robustness. Explores adversarial robustness, uncertainty quantification, safety verification, reachability analysis, and safe/robust reinforcement learning. Examines neural network relaxations and their applications in robotics, control, image classification, medical diagnosis, and language modeling.",[],[],[],Computer Science,[]
CS,7280,Special Topics in Database Management,4,Offers various topics. Possible areas include object-oriented database systems and distributed database systems. May be repeated up to two times.,[],[],[],Computer Science,[]
CS,7290,Special Topics in Data Science,4,"Offers special topics in data science, including machine learning, statistics, data mining, parallel and distributed data analysis, database systems, information retrieval, knowledge representation, information visualization, natural language processing, computational biology and bioinformatics, computational social science, digital humanities, health informatics, business, and predictive analytics. May be repeated once for up to 8 total credits.",[],[],[],Computer Science,[]
CS,7295,Special Topics in Data Visualization,4,Offers various topics in data visualization. May be repeated once.,[],[],[],Computer Science,[]
