department_tag,course_code,name,credits,description,corequisites,prerequisites,attributes,department,group_numbers
CS,7300,Empirical Research Methods for Human Computer Interaction,4,"Introduces concepts related to human subject studies for human computer interaction and personal health informatics. Discusses the methodological foundations, as well as issues of practical implementation and use. Provides an overview of the most common experimental designs used in these fields, and how studies should be proposed, conducted, analyzed, and documented for publication. Covers qualitative methods, including interviewing and focus groups, along with approaches to inductive qualitative data analysis. Methods discussed in the course are useful in any area of science that involves the application of the scientific method to situations involving people interacting with computational artifacts or systems, including observation, hypothesis formation, measurement, and descriptive and inferential statistical analyses.",[],[],[],Computer Science,[]
CS,7332,Machine Learning with Graphs,4,"Covers a number of advanced topics in machine learning and data mining on graphs, including vertex classification, graph clustering, link prediction and analysis, graph distance functions, graph embedding and representation learning, deep learning for graphs, anomaly detection, graph summarization, network inference, adversarial learning on networks, and notions of fairness in social networks. Seeks to familiarize students with state-of-the-art descriptive and predictive algorithms on graphs. Requires a foundational understanding of calculus and linear algebra, probability, machine learning or data mining, algorithms, and programming skills.",[],['PHYS 5116'],[],Computer Science,[1]
CS,7340,Theory and Methods in Human Computer Interaction,4,"Covers the foundations of human abilities, computational artifacts, design, and evaluation. Human computer interaction concerns the design and evaluation of software based on a deep understanding of how humans interact with computers, devices, and sensors. The field merges theories from psychology and computer science, using methods from AI and design. Introduces cognitive, perceptual, and affective theories and theories of individual differences that allow us to design and develop better computer software and systems. Also covers research methods for designing and evaluating computer software systems. Topics discussed in the context of next-generation interaction modalities include sensors, haptics, wearables, and performative interfaces. Students who do not meet course restrictions may seek permission of instructor.",[],[],[],Computer Science,[]
CS,7375,Seminar in Human-Computer Interaction,4,"Offers students an opportunity to read and present various survey and research papers in human-computer interaction, computer-supported collaborative work, data visualization, social computing, design, critical computing, accessibility, game design, health informatics, personal health informatics, human-robot interaction, or HCI in security. May be repeated once.",[],[],[],Computer Science,[]
CS,7380,Special Topics in Graphics/Image Processing,4,Offers various topics on graphics/image processing. May be repeated up to two times.,[],[],[],Computer Science,[]
CS,7390,Special Topics in Human-Centered Computing,4,Offers various topics in human-centered computing. May be repeated once.,[],[],[],Computer Science,[]
CS,7400,Intensive Principles of Programming Languages,4,"Studies the basic components of programming languages, specification of syntax and semantics, and description and implementation of programming language features. Discusses examples from a variety of languages.",[],[],[],Computer Science,[]
CS,7430,"Formal Specification, Verification, and Synthesis",4,"Covers software and system modeling (how to formally describe the behavior of software and systems); specification (how to formally state the properties that the system should have); verification (how to check whether—and ultimately prove—that a system satisfies its specification); and synthesis (how to automatically generate software and systems that are ""correct-by-construction"").",[],[],[],Computer Science,[]
CS,7480,Special Topics in Programming Language,4,Offers various topics in programming language. May be repeated up to two times.,[],[],[],Computer Science,[]
CS,7485,Special Topics in Formal Methods,4,Offers various topics in formal methods. May be repeated without limit.,[],[],[],Computer Science,[]
CS,7580,Special Topics in Software Engineering,4,Offers various topics on software engineering. May be repeated up to two times.,[],[],[],Computer Science,[]
CS,7600,Intensive Computer Systems,4,"Studies the structure, components, design, implementation, and internal operation of computer systems, focusing on the operating system level. Reviews computer hardware and architecture including the arithmetic and logic unit, and the control unit. Covers current operating system components and construction techniques including the memory and memory controller, I/O device management, device drivers, memory management, file system structures, and the user interface. Discusses distributed operating systems, real-time systems, and addresses concurrent processes, scheduling, interprocess communication, and synchronization. Discusses relevant distributed algorithms. Also covers design and analysis techniques for desirable properties in computer systems including functional correctness (in the absence of faults), performance and throughput, fault-tolerance and reliability, real-time response, security, and quality of service. Draws examples from real operating systems. Emphasizes abstraction, while programming exercises are used to facilitate the understanding of concepts.",[],[],[],Computer Science,[]
CS,7610,Foundations of Distributed Systems,4,"Covers foundational concepts in the design and implementation of efficient and reliable distributed computing systems. Covers internet communication protocols, fault-tolerant computing, synchronization protocols, synchronous and asynchronous computing, dynamic group communication systems, load balancing, Byzantine models, distributed hash tables, distributed file systems, and application of foundational concepts to modern distributed systems in the field. Requires knowledge of operating systems; e.g., an undergraduate course in Systems and Networks, Computer Systems, or Networks and Distributed systems.",[],[],[],Computer Science,[]
CS,7675,Master's Research,4,Exposes students to research in the fields of computer sciences. Explores how the scientific method is applied to these fields and covers the breadth of subareas of specialty that exist. Offers students an opportunity to practice how to locate and read scientific literature in different subareas. May be repeated once.,[],[],[],Computer Science,[]
CS,7680,Special Topics in Computer Systems,4,Offers various topics on computer systems. May be repeated up to two times.,[],[],[],Computer Science,[]
CS,7800,Advanced Algorithms,4,"Presents advanced mathematical techniques for designing and analyzing computer algorithms. Reviews some of the material covered in CS 5800 and then covers advanced topics. Emphasizes theoretical underpinnings of techniques used to solve problems arising in diverse domains. Topics include asymptotic analysis, advanced data structures, dynamic programming, greedy algorithms and matroid theory, amortized analysis, randomization, string matching, algebraic algorithms, and approximation algorithms. Introduces Turing machines, P and NP classes, polynomial-time reducibility, and NP completeness.",[],[],[],Computer Science,[]
CS,7805,Complexity Theory,4,"Covers core topics in computational complexity, including NP-completeness, time and space complexity, polynomial hierarchy, circuit complexity, probabilistic computation, interactive proofs, and hardness of approximation. Moves to more advanced topics that may include lower bounds, pseudorandomness, cryptography, and communication complexity.",[],['CS 7800'],[],Computer Science,[1]
CS,7810,Foundations of Cryptography,4,"Offers students at the PhD level an accelerated introduction to cryptography and quickly progresses to advanced topics that are at the forefront of current research. Cryptography is the science of protecting information against adversarial eavesdropping and tampering. Examines what kind of security properties can be achieved by relying solely on probability and information theory, without restricting the adversary’s computational power. Studies the complexity-theoretic basis of modern cryptography and the connection between computational hardness and pseudo-randomness. Explores, as the main component of the course, how to take a few well-studied problems in number theory and algebra and use them to build powerful cryptosystems with advanced functionality and security properties. Requires prior completion of an undergraduate course in the theory of computation.",[],[],[],Computer Science,[]
CS,7840,Foundations and Applications of Information Theory,4,"Studies information theory and selected applications for data management, machine learning, and information retrieval. Information theory examines the transmission, processing, extraction, and utilization of information. Topics include entropy; mutual information; cross-entropy; data processing theorem; information inequalities; Cox's theorem; maximum entropy solutions; and applications such as data normalization, decision trees, maximum likelihood, logistic regression, and VC dimensions. Requires prior study of standard computer science algorithms. Offers hands-on experience through a flexible project, allowing students to explore information theory in aspects related to their PhD research.",[],[],[],Computer Science,[]
CS,7880,Special Topics in Theoretical Computer Science,4,"Covers various topics including advanced cryptography, approximation algorithms, complexity theory, computational algebra, distributed computing, formal verification, network algorithms, online computation, parallel computing, and randomness and computation. May be repeated up to two times.",[],[],[],Computer Science,[]
CS,7930,Effective Scientific Writing in Computer Science,2,"Introduces the principles and practice of technical communication in computer science and related fields. Emphasizes concepts such as genre, structure, argument, and audience expectations. Focuses on the story of scientific research and how it manifests in written genre like the abstract, research statement, and conference paper, with a portion of the course focused on presentation design and delivery.",[],[],[],Computer Science,[]
CS,7980,Research Capstone,4,"Offers students a culminating experience to demonstrate proficiency in key concepts learned throughout their programs in the core and elective courses. Designed to reinforce concepts in ethics and basic concepts in research, beyond an emphasis on the technical principles learned throughout the program.",[],"['CS 5004', 'CS 5010', 'CS 5800']",[],Computer Science,"[1, 1, 2]"
CS,7986,Research,0,Offers students an opportunity to conduct full-time research under faculty supervision.,[],[],[],Computer Science,[]
CS,7990,Thesis,4,Offers selected work with the agreement of a project supervisor. May be repeated once.,[],[],[],Computer Science,[]
CS,7996,Thesis Continuation - Half-Time,0,Offers continued thesis work conducted under the supervision of a departmental faculty.,[],['CS 7990'],[],Computer Science,[1]
CS,8674,Master’s Project,4,Offers selected work with the agreement of a project supervisor. May be repeated once.,[],[],[],Computer Science,[]
CS,8948,Research Work Experience - Half-Time,0,Provides an opportunity for all doctoral students to engage in industry research in the area of their dissertation. Doctoral students register for this course before starting their off-campus internship. May be repeated up to five times.,[],[],[],Computer Science,[]
CS,8949,Research Work Experience,0,Provides an opportunity for all doctoral students to engage in industry research in the area of their dissertation. Doctoral students register for this course before starting their off-campus internships. May be repeated without limit.,[],[],[],Computer Science,[]
CS,8986,Research,0,Offers an opportunity to conduct full-time research under faculty supervision. May be repeated without limit.,[],[],[],Computer Science,[]
CS,9000,PhD Candidacy Achieved,0,Indicates successful completion of the doctoral comprehensive exam.,[],[],[],Computer Science,[]
CS,9990,Dissertation Term 1,0,Offers selected work with the agreement of a thesis supervisor.,[],['CS 9000'],[],Computer Science,[1]
CS,9991,Dissertation Term 2,0,Offers dissertation supervision by members of the department.,[],['CS 9990'],[],Computer Science,[1]
CS,9996,Dissertation Continuation,0,Continues work with the agreement of a thesis supervisor.,[],['CS 9991'],[],Computer Science,[1]
