department_tag,course_code,name,credits,description,corequisites,prerequisites,attributes,department,group_numbers
CS,4530,Fundamentals of Software Engineering,4,"Covers the fundamentals of software engineering, including software development life cycle models (e.g., waterfall, spiral,agile); requirements analysis; user-centered design; software design principles and patterns; testing (functional testing, structural testing, testing strategies); code refactoring and debugging; software architecture and design; and integration and deployment. Includes a course project in which some of the software engineering methods (from requirements analysis to testing) are applied in a team-based setting.",[],"['CS 3100', 'CS 3500']","['Capstone Experience', 'Writing Intensive']",Computer Science,"[1, 1]"
CS,4535,Professional Practicum Capstone,4,"Offers students an opportunity to expand skills in real-world application development and team collaboration within an experiential learning structure. Involves students in industry-specific projects designed to integrate into an industry partner’s intellectual property portfolio. Projects focus on software design and development and also include written components that align with the partner’s standards and reference relevant prior work. Students engage in a structured process of milestones and feedback cycles with peers; instructors; and, as appropriate, industry partners to refine project outcomes.",[],[],"['Capstone Experience', 'Integration Experience', 'Writing Intensive']",Computer Science,[]
CS,4550,Web Development,4,"Discusses Web development for sites that are dynamic, data driven, and interactive. Focuses on the software development issues of integrating multiple languages, assorted data technologies, and Web interaction. Considers ASP.NET, C#, HTTP, HTML, CSS, XML, XSLT, JavaScript, AJAX, RSS/Atom, SQL, and Web services. Requires each student to deploy individually designed Web experiments that illustrate the Web technologies and at least one major integrative Web site project. Students may work as a team with the permission of the instructor. Each student or team must also create extensive documentation of their goals, plans, design decisions, accomplishments, and user guidelines. All source files must be open and be automatically served by a sources server.",[],"['CS 3100', 'DS 3500']","['Capstone Experience', 'Writing Intensive']",Computer Science,"[1, 1]"
CS,4610,Robotic Science and Systems,4,"Introduces autonomous mobile robots, with a focus on algorithms and software development, including closed-loop control, robot software architecture, wheeled locomotion and navigation, tactile and basic visual sensing, obstacle detection and avoidance, and grasping and manipulation of objects. Offers students an opportunity to progressively construct mobile robots from a predesigned electromechanical kit. The robots are controlled wirelessly by software of the students’ own design, built within a provided robotics software framework. The course culminates in a grand challenge competition using all features of the robots.",[],"['CS 3100', 'CS 3500']",[],Computer Science,"[1, 1]"
CS,4700,Network Fundamentals,4,"Introduces the fundamental concepts of network protocols and network architectures. Presents the different harmonizing functions needed for the communication and effective operation of computer networks. Provides in-depth coverage of data link control, medium access control, routing, end-to-end transport protocols, congestion and flow control, multicasting, naming, auto configuration, quality of service, and network management. Studies the abstract mechanisms and algorithms as implemented in real-world Internet protocols. Also covers the most common application protocols (e-mail, Web, and ftp).",[],"['CS 3650', 'CS 5600', 'CS 5600']",[],Computer Science,"[1, 1, 1]"
CS,4730,Distributed Systems,4,"Introduces distributed systems, covering fundamental concepts and showing how they are applied to build reliable distributed services. Examines several existing distributed applications, such as file systems, databases, lock services, digital currencies, smart contracts, and machine learning, and how these applications must coordinate to function and overcome failures, network partitions, or compromised parties. Distributed systems, such as databases, cloud services, and blockchains, are omnipresent in the services and applications that serve society on a daily basis.",[],['CS 3650'],[],Computer Science,[1]
CS,4805,Fundamentals of Complexity Theory,4,"Reviews basic material such as automata, Turing machines, (un)decidability, time complexity, P vs. NP, and NP-completeness. Studies core topics in computational complexity, including time and space complexity, polynomial hierarchy, circuit complexity, probabilistic computation, interactive proofs, and hardness of approximation. Optional topics may include Gödel's incompleteness theorem, Kolgomorov complexity, cryptography, quantum computing, communication complexity, lower bounds, or pseudorandomness.",[],['CS 3800'],[],Computer Science,[1]
CS,4810,Advanced Algorithms,4,"Builds on CS 3000. Presents an advanced study of computer algorithms. Covers basic algorithmic paradigms (e.g., greedy, divide-and-conquer, and dynamic programming); graph algorithms; optimization; computational Intractability (e.g., NP-completeness, PSPACE-completeness); randomized algorithms; and approximation algorithms.",[],['CS 3000'],[],Computer Science,[1]
CS,4820,Computer-Aided Reasoning,4,"Covers fundamental concepts, techniques, and algorithms in computer-aided reasoning, including propositional logic, variants of the DPLL algorithm for satisfiability checking, first-order logic, unification, tableaux, resolution, Horn clauses, congruence closure, rewriting, Knuth-Bendix completion, decision procedures, Satisfiability Modulo Theories, recursion, induction, termination, Presburger arithmetic, quantifier elimination, and interactive theorem proving. Offers students an opportunity to develop and implement a reasoning engine in a sequence of projects over the course of the semester. Also covers how to formalize and reason about computational systems using a modern interactive theorem prover.",[],"['CS 2800', 'CS 3000']",['Capstone Experience'],Computer Science,"[1, 1]"
CS,4830,"System Specification, Verification, and Synthesis",4,"Covers the fundamental topics in formal modeling and specification (transition systems, temporal logic, regular and omega-regular languages, safety and liveness properties, etc.); computer-aided verification (state-space exploration, model checking, bounded-model checking, binary-decision diagrams, symbolic model checking, etc.); compositionality and assume-guarantee reasoning; contracts; and component-based design. Also covers fundamental topics in computer-aided synthesis of correct-by-construction systems, starting from high-level formal specifications or from example scenarios. Designing large and complex systems (digital circuits, embedded control systems such as automated vehicles, computerized healthcare devices such as pacemakers, cyber-physical systems such as automated intersections, etc.) and their software cannot be done by hand. Instead, designers use computer-aided techniques that allow them to build system models and verify correctness of the design before the real system is actually built.",[],['CS 3000'],[],Computer Science,[1]
CS,4850,Building Game Engines,4,"Discusses the components of game engines and strategies for their software implementation. Includes graphics management algorithms (animation, scene graph, level of detail); basic artificial intelligence algorithms (search, decision making, sensing); and related algorithmic issues (networking, threading, input processing). Explores the use of data-driven software design. Offers students an opportunity to use a rendering engine and to build and integrate several software components to create a complete game engine. Requires students to work on several individual assignments to apply the algorithms and then develop a project in a team. Offers students an opportunity to learn team/project management; work division; team communication; and the software development cycle of implementation, testing, critique, and further iteration. Students who do not meet course prerequisites may seek permission of instructor.",[],['CS 3520'],[],Computer Science,[1]
CS,4950,Computer Science Research Seminar,1,"Offers students an in-depth look at research in a particular subarea of computer science, information science, data science, or cybersecurity. The particular subarea varies from semester to semester. Exposes students to current research topics, often via guest faculty members. Offers students an opportunity to practice reading and discussing scientific literature, presenting scientific work, and distilling the key ideas and contributions of papers through required weekly paper summaries. May be repeated once.",[],['CS 3950'],[],Computer Science,[1]
CS,4955,Computer Science Teaching Seminar,1,"Introduces techniques and frameworks to prepare undergraduate students to become more effective teaching assistants in the field of computer science. Students analyze and reflect on literature, case studies, and real examples of teaching computer science. Offers students an opportunity to participate within in-class activities to learn presentation skills, to practice speaking to different audience sizes, and to learn how to work with different types of audiences. Culminates with a final capstone project in which students prepare and present a lecture on a topic in computer science. Successful students are prepared for careers in teaching, presenting technical content when pursuing graduate studies, and for presenting technical information in industry.",[],[],[],Computer Science,[]
CS,4970,Junior/Senior Honors Project 1,4,Focuses on in-depth project in which a student conducts research or produces a product related to the student’s major field. Combined with Junior/Senior Project 2 or college-defined equivalent for 8 credit honors in the discipline project.,[],[],[],Computer Science,[]
CS,4971,Junior/Senior Honors Project 2,4,Focuses on second semester of in-depth project in which a student conducts research or produces a product related to the student’s major field.,[],['CS 4970'],[],Computer Science,[1]
CS,4973,Topics in Computer Science,4,Offers a lecture course in computer science on a topic not regularly taught in a formal course. Topics may vary from offering to offering. May be repeated up to three times.,[],"['CS 3000', 'CS 3100', 'DS 3500']",[],Computer Science,"[1, 1, 1]"
CS,4998,Research,0,Offers an opportunity to document student contributions to research projects or creative endeavors.,[],[],[],Computer Science,[]
CS,5001,Intensive Foundations of Computer Science,4,"Introduces systematic problem solving through programming. Offers students an opportunity to learn how to analyze a problem, how to divide and organize the problem into appropriate components, how to describe the problem in a computer language, how to analyze and understand the behavior of their programs, and how to test that their programs are working correctly. Additionally, introduces a method of program design called object-oriented programming and various ways to organize data, including a discussion of their advantages and disadvantages. To practice the course concepts, students undertake assignments ranging from small, highly specified programming tasks to larger open-ended problems where students design and code their own solutions.",['CS 5003'],[],[],Computer Science,[]
CS,5002,Discrete Structures,4,"Introduces the mathematical structures and methods that form the foundation of computer science. Studies structures such as sets, tuples, sequences, lists, trees, and graphs. Discusses functions, relations, ordering, and equivalence relations. Examines inductive and recursive definitions of structures and functions. Covers principles of proof such as truth tables, inductive proof, and basic logic and the counting techniques and arguments needed to estimate the size of sets, the growth of functions, and the space-time complexity of algorithms. Also, discusses data structures such as arrays, stacks, queues, lists, and the algorithms that manipulate them.",[],[],[],Computer Science,[]
CS,5003,Recitation for CS 5001,0,Provides a small-group discussion format to cover material in CS 5001.,['CS 5001'],[],[],Computer Science,[]
CS,5004,Object-Oriented Design,4,"Presents a comparative approach to object-oriented programming and design. Discusses the concepts of object, class, metaclass, message, method, inheritance, and genericity. Reviews forms of polymorphism in object-oriented languages. Contrasts the use of inheritance and composition as dual techniques for software reuse—forwarding vs. delegation and subclassing vs. subtyping. Offers students an opportunity to obtain a deeper understanding of the principles of object-oriented programming and design, including software components, object-oriented design patterns, and the use of graphical design notations such as UML (unified modeling language). Illustrates basic concepts in object-oriented design with case studies in application frameworks and by writing programs in Java.",['CS 5005'],"['CS 5001', 'CS 5001', 'CS 5002', 'CS 5002']",[],Computer Science,"[1, 1, 2, 2]"
CS,5005,Recitation for CS 5004,0,Provides small-group discussion format to cover material in CS 5004.,['CS 5004'],[],[],Computer Science,[]
CS,5008,"Data Structures, Algorithms, and Their Applications within Computer Systems",4,"Presents an integrated approach to the study of data structures, algorithms, and their application within systems topics. Introduces a variety of fundamental algorithmic techniques (divide-and-conquer, dynamic programming, graph algorithms) and systems topics (models of computation, computer architecture, compilation, system software, networking). Demonstrates the integration of topics through programming assignments in the C language that implement fundamental data structures (lists, queues, trees, maps, graphs) and algorithms as they are applied in computer systems. Additional breadth topics include programming applications that expose students to primitives of different subsystems using threads and sockets.",['CS 5009'],"['CS 5001', 'CS 5001', 'CS 5002', 'CS 5002']",[],Computer Science,"[1, 1, 2, 2]"
CS,5009,Recitation for CS 5008,0,Provides small-group active learning format to augment material in CS 5008.,['CS 5008'],[],[],Computer Science,[]
CS,5010,Programming Design Paradigm,4,"Introduces modern program design paradigms. Starts with functional program design, introducing the notion of a design recipe. The latter consists of two parts: a task organization (ranging from the description of data to the creation of a test suite) and a data-oriented approach to the organization of programs (ranging from atomic data to self-referential data definitions and functions as data). The course then progresses to object-oriented design, explaining how it generalizes and contrasts with functional design. In addition to studying program design, students also have an opportunity to practice pair-programming and public code review techniques, as found in industry today.",['CS 5011'],[],[],Computer Science,[]
CS,5011,Recitation for CS 5010,0,Provides small-group discussion format to cover material in CS 5010.,['CS 5010'],[],[],Computer Science,[]
CS,5047,Exploring AI Trends and Tools,4,"Explores key ideas in artificial intelligence while delving into trending developments in the field. Examines AI tools and frameworks to enable collaboration effectively and efficiently across technical and nontechnical stakeholders. Analyzes topics such as AI-enabled perception, representation, reasoning, and learning as contextualized by societal impact. Offers students an opportunity to obtain the knowledge and skills necessary to confidently navigate the ever-evolving landscape of AI.",[],[],[],Computer Science,[]
CS,5097,Mixed Reality,4,"Seeks to provide a strong foundation in the fundamentals of virtual and augmented reality, broadly defined as mixed reality (XR), and hands-on experience developing XR applications. Offers students an opportunity to dive into this burgeoning area of research and practice in computer science. Given the complex nature of XR environments, this course synthesizes theoretical and practice knowledge from various disciplines, including computer graphics, 3D interfaces, human-computer interaction, tracking systems, and perceptual psychology (to name a few). XR technologies have recently witnessed a resurgence of interest.",[],[],[],Computer Science,[]
CS,5100,Foundations of Artificial Intelligence,4,"Introduces the fundamental problems, theories, and algorithms of the artificial intelligence field. Topics include heuristic search and game trees, knowledge representation using predicate calculus, automated deduction and its applications, problem solving and planning, and introduction to machine learning. Required course work includes the creation of working programs that solve problems, reason logically, and/or improve their own performance using techniques presented in the course.",[],[],"['Capstone Experience', 'Writing Intensive']",Computer Science,[]
CS,5130,Applied Programming and Data Processing for AI,4,"Presents an in-depth exploration of programming paradigms, mathematical foundations, and computational techniques essential for scientific computing and data-driven applications. Integrates linear algebra, Python programming principles, algorithmic design, and data science methodologies to offer students an opportunity to develop the technical expertise necessary for handling complex numerical computations and large-scale data processing. Strongly emphasizes Pythonic programming, object-oriented and functional programming, data preprocessing, visualization, and numerical stability, with the aim of developing the skills needed to write clean, efficient, and maintainable code for scientific and engineering applications.",['CS 5131'],[],[],Computer Science,[]
CS,5131,Recitation for CS 5130,0,Provides small-group discussion format to cover material in CS 5130.,['CS 5130'],[],[],Computer Science,[]
CS,5150,Game Artificial Intelligence,4,"Offers an overview of classical and modern approaches to artificial intelligence in digital games. Focuses on the creation of believable agents and environments with the goal of providing a fun and engaging experience to a player. Covers player modeling, procedural content generation, behavior trees, interactive narrative, decision-making systems, cognitive modeling, and path planning. Explores different approaches for behavior generation, including learning and rule-based systems. Requires students to complete several individual assignments in these areas to apply the concepts covered in class. Students choose a group final project, which requires a report, to explore one aspect of artificial intelligence for games in further depth. Offers students an opportunity to learn team management and communication. Requires knowledge of algorithms and experience with object-oriented design or functional programming.",[],[],"['Capstone Experience', 'Writing Intensive']",Computer Science,[]
CS,5170,Artificial Intelligence for Human-Computer Interaction,4,"Offers an overview of the wide range of AI techniques that exploit knowledge of the domain and humans to facilitate interaction between humans and systems, mediate human-human interaction, leverage humans to improve system performance, and promote beneficial outcomes at the social and individual level. Topics can include AI/human computation, plan and activity recognition, smart sensing/homes, active learning, preference elicitation, intelligent/adaptive user interfaces, and mixed human-agent simulations. Studies how to design and develop intelligent interaction technologies while also critically assessing their social and ethical impact.",[],"['CS 5100', 'CS 5800', 'CS 6140']",[],Computer Science,"[1, 1, 1]"
CS,5180,Reinforcement Learning and Sequential Decision Making,4,"Introduces reinforcement learning and the underlying computational frameworks and the Markov decision process framework. Covers a variety of reinforcement learning algorithms, including model-based, model-free, value function, policy gradient, actor-critic, and Monte Carlo methods. Examines commonly used representations including deep learning representations and approaches to partially observable problems. Students are expected to have a working knowledge of probability and linear algebra, to complete programming assignments, and to complete a course project that applies some form of reinforcement learning to a problem of interest.",[],[],[],Computer Science,[]
CS,5200,Database Management Systems,4,"Introduces relational database management systems as a class of software systems. Prepares students to be sophisticated users of database management systems. Covers design theory, query language, and performance/tuning issues. Topics include relational algebra, SQL, stored procedures, user-defined functions, cursors, embedded SQL programs, client-server interfaces, entity-relationship diagrams, normalization, B-trees, concurrency, transactions, database security, constraints, object-relational DBMSs, and specialized engines such as spatial, text, XML conversion, and time series. Includes exercises using a commercial relational or object-relational database management system.",[],[],['Analyzing/Using Data'],Computer Science,[]
CS,5310,Computer Graphics,4,"Introduces the fundamentals of two-dimensional and three-dimensional computer graphics, with an emphasis on approaches for obtaining realistic images. Covers two-dimensional algorithms for drawing lines and curves, anti-aliasing, filling, and clipping. Studies rendering of three-dimensional scenes composed of spheres, polygons, quadric surfaces, and bi-cubic surfaces using ray-tracing and radiosity. Includes techniques for adding texture to surfaces using texture and bump maps, noise, and turbulence. Requires knowledge of linear algebra.",[],['MATH 2331'],"['Capstone Experience', 'Writing Intensive']",Computer Science,[1]
CS,5330,Pattern Recognition and Computer Vision,4,"Introduces fundamental techniques for low-level and high-level computer vision. Examines image formation, early processing, boundary detection, image segmentation, texture analysis, shape from shading, photometric stereo, motion analysis via optic flow, object modeling, shape description, and object recognition (classification). Discusses models of human vision (gestalt effects, texture perception, subjective contours, visual illusions, apparent motion, mental rotations, and cyclopean vision). Requires knowledge of linear algebra.",[],['MATH 2331'],[],Computer Science,[1]
CS,5335,Robotic Science and Systems,4,"Introduces autonomous mobile robots with a focus on algorithms and software development, including closed-loop control, robot software architecture, wheeled locomotion and navigation, tactile and basic visual sensing, obstacle detection and avoidance, and grasping and manipulation of objects. Offers students an opportunity to progressively construct mobile robots from a predesigned electromechanical kit. The robots are controlled wirelessly by software of the students’ own design, built within a provided robotics software framework. Culminates in a project that connects the algorithms and hardware developed in the course with a selected topic in the current robotics research literature.",[],[],[],Computer Science,[]
CS,5340,Computer/Human Interaction,4,"Covers the principles of human-computer interaction and the design and evaluation of user interfaces. Topics include an overview of human information processing subsystems (perception, memory, attention, and problem solving); how the properties of these systems affect the design of user interfaces; the principles, guidelines, and specification languages for designing good user interfaces, with emphasis on tool kits and libraries of standard graphical user interface objects; and a variety of interface evaluation methodologies that can be used to measure the usability of software. Other topics may include World Wide Web design principles and tools, computer-supported cooperative work, multimodal and “next generation” interfaces, speech and natural language interfaces, and virtual reality interfaces. Course work includes both the creation and implementation of original user interface designs, and the evaluation of user interfaces created by others. Requires knowledge of C programming language/UNIX.",[],[],[],Computer Science,[]
CS,5350,Computational Geometry,4,"Surveys practical techniques for representing geometric objects in two and three dimensions, for computing their motions and interactions, and for human interfaces to manipulate them. These techniques are useful not only in graphics but also in robotics, computer vision, game design, geographic information systems, computer-aided design and manufacturing, spatial reasoning and planning, physical simulation, biomechanics, and the implementation of many types of human-computer interface. Requires undergraduate background in algorithms.",[],"['CS 5800', 'CS 7800']",[],Computer Science,"[1, 1]"
